{
  "$schema": "./config.schema.json",
  "architecture": "x64",
  "bitness": 64,
  "msysEnv": "UCRT64",
  "componentSelection": true,
  "downloads": [
    {
      "name": "Arm GNU Toolchain",
      "file": "arm-gnu-toolchain-15.3.rel2-mingw-w64-x86_64-arm-none-eabi.zip",
      "href": "https://gitlab.arm.com/api/v4/projects/tooling%2Fgnu-toolchains-for-arm/packages/generic/gnu-toolchain/15.3.rel2/arm-gnu-toolchain-15.3.rel2-mingw-w64-x86_64-arm-none-eabi.zip",
      "dirName": "arm-gnu-toolchain",
      "installLevel": 2
    },
    {
      "name": "CMake",
      "file": "cmake-4.4.4-windows-x86_64.zip",
      "href": "https://github.com/Kitware/CMake/releases/download/v4.4.4/cmake-4.4.4-windows-x86_64.zip",
      "dirName": "cmake",
      "extractStrip": 1,
      "installLevel": 2
    },
    {
      "name": "Ninja",
      "file": "ninja-win.zip",
      "href": "https://github.com/ninja-build/ninja/releases/download/v1.13.2/ninja-win.zip",
      "dirName": "ninja",
      "installLevel": 2
    },
    {
      "name": "Python 3.14",
      "file": "python-3.14.8-embed-amd64.zip",
      "href": "https://www.python.org/ftp/python/3.14.8/python-3.14.8-embed-amd64.zip",
      "dirName": "python",
      "installLevel": 3
    },
    {
      "name": "Git for Windows",
      "file": "MinGit-2.56.0.2-64-bit.zip",
      "href": "https://github.com/git-for-windows/git/releases/download/v2.56.0.windows.2/MinGit-2.56.0.2-64-bit.zip",
      "dirName": "git",
      "installLevel": 3
    }
  ]
}
